{"$id":"https://terminal-zero.invalid/contracts/gv_fs0/v1/schemas/gv_fs0_certified_decision_result_v1.schema.json","$schema":"https://json-schema.org/draft/2020-12/schema","additionalProperties":false,"properties":{"book_id":{"pattern":"^BOOK_[0-9a-f]{64}$","type":"string"},"certification":{"$ref":"gv_fs0_certification_v1.schema.json"},"certification_reference_event":{"$ref":"gv_fs0_portfolio_event_v1.schema.json"},"certified_decision_result_hash":{"pattern":"^[0-9a-f]{64}$","type":"string"},"certified_decision_result_id":{"pattern":"^CDR_[0-9a-f]{64}$","type":"string"},"decision":{"$ref":"gv_fs0_decision_envelope_v1.schema.json"},"economic_payload_hash":{"pattern":"^[0-9a-f]{64}$","type":"string"},"events":{"items":{"$ref":"gv_fs0_portfolio_event_v1.schema.json"},"type":"array"},"presentation":{"additionalProperties":false,"properties":{"presentation_hash":{"pattern":"^[0-9a-f]{64}$","type":"string"},"rows":{"items":{"additionalProperties":false,"properties":{"label":{"pattern":"^[A-Za-z0-9][A-Za-z0-9._:-]{0,191}$","type":"string"},"value":{"type":"string"}},"required":["label","value"],"type":"object"},"type":"array"}},"required":["presentation_hash","rows"],"type":"object"},"retained_verifier_results":{"items":{"additionalProperties":false,"properties":{"verifier_result":{"$ref":"gv_fs0_verifier_result_v1.schema.json"},"verifier_result_hash":{"pattern":"^[0-9a-f]{64}$","type":"string"}},"required":["verifier_result_hash","verifier_result"],"type":"object"},"type":"array","uniqueItems":true},"role":{"enum":["OPEN","NO_POSITION"],"type":"string"},"schema_version":{"const":"gv_fs0_certified_decision_result_v1","type":"string"},"snapshots":{"items":{"$ref":"gv_fs0_snapshot_v1.schema.json"},"minItems":1,"type":"array"},"verifier_attempts":{"items":false,"maxItems":2,"minItems":2,"prefixItems":[{"allOf":[{"$ref":"gv_fs0_verifier_attempt_v1.schema.json"},{"properties":{"ordinal":{"const":1}}}]},{"allOf":[{"$ref":"gv_fs0_verifier_attempt_v1.schema.json"},{"properties":{"ordinal":{"const":2}}}]}],"type":"array"}},"required":["schema_version","certified_decision_result_id","certified_decision_result_hash","role","decision","book_id","events","snapshots","economic_payload_hash","verifier_attempts","retained_verifier_results","certification","certification_reference_event","presentation"],"title":"gv_fs0_certified_decision_result_v1","type":"object"}
