{"book_id":"BOOK_5ffe57275f0cd6de7bdc1c99aa135ba9a7078afe8993b8f418452dd39b3fe0cd","certification":{"book_id":"BOOK_5ffe57275f0cd6de7bdc1c99aa135ba9a7078afe8993b8f418452dd39b3fe0cd","certification_failure_registry_hash":"bee0d3dcf160bce6b8479893aa23cde16d73b2295319b7648af317f88d79573a","certification_failure_registry_version":"gv_fs0_certification_failure_registry_v1","certification_id":"CERT_308076a3e72b225de52c0647e16b66569faf299a3cd7a71357a03f5d3b28d476","certification_status":"CERTIFIED","checks":{"canonical_hash_reproduced":"TRUE","cash_conserved":"TRUE","decision_authority_valid":"TRUE","holdings_valid":"TRUE","independent_reconstruction_passed":"TRUE","nav_reconciled":"TRUE","price_freshness_valid":"TRUE","receivables_reconciled":"TRUE","timestamp_causality_valid":"TRUE","unsupported_events_absent":"TRUE"},"decision_hash":"73cba00136d97ab16dedfd2e126756fefb4e9c0ecad8b66b7911539f13235871","decision_id":"DECISION_E0A_HOLD_FOR_EVIDENCE_1","failure_bindings":[],"fixture_hash":"3e927808f804b0c40b1ed286fd60df392b2b4dca566e9de43c5773b308086ef3","fixture_id":"FIXTURE_NO_POSITION_1","primary_economic_payload_hash":"7b197f744f917ff9f3c7f2bfa6d34eb1e19bd8fc8e5048f9819816f66dbe2d42","protocol_id":"GV_FS0_PROTOCOL_V1","protocol_version":"V1","schema_version":"gv_fs0_certification_v1","terminal_snapshot_id":"SNAP_2ef0fc2b4862ed561f4a3192032b459b19991e9b6ded2dac5f051896665bc92c","verifier_attempts":[{"controller_failure_code":null,"ordinal":1,"outcome":"RESULT","schema_version":"gv_fs0_verifier_attempt_v1","verifier_result_hash":"8dbf280477a159bc7a0180fb876a98a580c4f2dc806903465f64f869f7ddf109"},{"controller_failure_code":null,"ordinal":2,"outcome":"RESULT","schema_version":"gv_fs0_verifier_attempt_v1","verifier_result_hash":"8dbf280477a159bc7a0180fb876a98a580c4f2dc806903465f64f869f7ddf109"}],"verifier_input_hash":"1a40ea82c81db0b42dcaaaea53cddcd4754029614a526f8ebcdbeb15f91557c9"},"certification_reference_event":{"book_id":"BOOK_5ffe57275f0cd6de7bdc1c99aa135ba9a7078afe8993b8f418452dd39b3fe0cd","decision_id":"DECISION_E0A_HOLD_FOR_EVIDENCE_1","effective_timestamp":"2026-07-17T20:00:00.000000Z","event_id":"EVT_3affd04091b5e9f640f64afa36639cd3169b8b4e4e833435fe796c15f4ae2764","event_type":"CERTIFICATION_REFERENCE","event_type_rank":90,"generated_event_slot":10,"intra_rank_sequence":0,"payload":{"cash_delta":null,"certification_id":"CERT_308076a3e72b225de52c0647e16b66569faf299a3cd7a71357a03f5d3b28d476","dividend_amount_per_share":null,"entitled_quantity":null,"execution_price":null,"fee":null,"payment_amount":null,"position_delta":null,"quantity":null,"receivable_amount":null,"referenced_entitlement_id":null,"terminal_snapshot_id":"SNAP_2ef0fc2b4862ed561f4a3192032b459b19991e9b6ded2dac5f051896665bc92c","valuation_price":null},"schema_version":"gv_fs0_portfolio_event_v1","security_id":"SEC_1","semantic_sequence":6,"session":"2026-07-17","source_intent_id":"CERTIFICATION:CERT_308076a3e72b225de52c0647e16b66569faf299a3cd7a71357a03f5d3b28d476","source_sequence":5},"certified_decision_result_hash":"627c136926ecf947f2ea00f24de85291d44ef5594016f022fac7f2217093d6e6","certified_decision_result_id":"CDR_627c136926ecf947f2ea00f24de85291d44ef5594016f022fac7f2217093d6e6","decision":{"action":"NO_POSITION","authority_tier":"MANUAL_OWNER_PAPER","decision_hash":"73cba00136d97ab16dedfd2e126756fefb4e9c0ecad8b66b7911539f13235871","decision_id":"DECISION_E0A_HOLD_FOR_EVIDENCE_1","decision_timestamp":"2026-07-12T00:00:00.000000Z","effective_timestamp":"2026-07-13T00:00:00.000000Z","fixture_hash":"3e927808f804b0c40b1ed286fd60df392b2b4dca566e9de43c5773b308086ef3","fixture_id":"FIXTURE_NO_POSITION_1","operator_id":"OWNER_1","protocol_id":"GV_FS0_PROTOCOL_V1","rationale_ref":"E0A:RD:b4694a69bd1bc35a0d97a839ad47b66b517da1bd0f4abccd56bacca22d9e8e38","requested_quantity_or_sizing_input":{"quantity":null},"schema_version":"gv_fs0_decision_envelope_v1","security_id":"SEC_1","supersedes_decision_id":null},"economic_payload_hash":"7b197f744f917ff9f3c7f2bfa6d34eb1e19bd8fc8e5048f9819816f66dbe2d42","events":[{"book_id":"BOOK_5ffe57275f0cd6de7bdc1c99aa135ba9a7078afe8993b8f418452dd39b3fe0cd","decision_id":"DECISION_E0A_HOLD_FOR_EVIDENCE_1","effective_timestamp":"2026-07-13T00:00:00.000000Z","event_id":"EVT_8892a324bc08cfdb333c02b5ca76079d618a0c40e06555dd38d76be09f3b0a6c","event_type":"DECISION_ACCEPTED","event_type_rank":10,"generated_event_slot":10,"intra_rank_sequence":0,"payload":{"cash_delta":null,"certification_id":null,"dividend_amount_per_share":null,"entitled_quantity":null,"execution_price":null,"fee":null,"payment_amount":null,"position_delta":null,"quantity":null,"receivable_amount":null,"referenced_entitlement_id":null,"terminal_snapshot_id":null,"valuation_price":null},"schema_version":"gv_fs0_portfolio_event_v1","security_id":"SEC_1","semantic_sequence":0,"session":"2026-07-13","source_intent_id":"DECISION:73cba00136d97ab16dedfd2e126756fefb4e9c0ecad8b66b7911539f13235871","source_sequence":0},{"book_id":"BOOK_5ffe57275f0cd6de7bdc1c99aa135ba9a7078afe8993b8f418452dd39b3fe0cd","decision_id":"DECISION_E0A_HOLD_FOR_EVIDENCE_1","effective_timestamp":"2026-07-13T20:00:00.000000Z","event_id":"EVT_514688413abbd804a0c5c41305a7b0fcc7f0ad91afd631cda7c7254a7dac40fd","event_type":"SESSION_VALUATION","event_type_rank":80,"generated_event_slot":10,"intra_rank_sequence":0,"payload":{"cash_delta":null,"certification_id":null,"dividend_amount_per_share":null,"entitled_quantity":null,"execution_price":null,"fee":null,"payment_amount":null,"position_delta":null,"quantity":null,"receivable_amount":null,"referenced_entitlement_id":null,"terminal_snapshot_id":null,"valuation_price":"10"},"schema_version":"gv_fs0_portfolio_event_v1","security_id":"SEC_1","semantic_sequence":1,"session":"2026-07-13","source_intent_id":"VALUATION_INSTRUCTION:0","source_sequence":0},{"book_id":"BOOK_5ffe57275f0cd6de7bdc1c99aa135ba9a7078afe8993b8f418452dd39b3fe0cd","decision_id":"DECISION_E0A_HOLD_FOR_EVIDENCE_1","effective_timestamp":"2026-07-14T20:00:00.000000Z","event_id":"EVT_d21d8f877f199213170a43c00fa0eefc7e97c8add93a7509c97bb576d4c9e024","event_type":"SESSION_VALUATION","event_type_rank":80,"generated_event_slot":10,"intra_rank_sequence":0,"payload":{"cash_delta":null,"certification_id":null,"dividend_amount_per_share":null,"entitled_quantity":null,"execution_price":null,"fee":null,"payment_amount":null,"position_delta":null,"quantity":null,"receivable_amount":null,"referenced_entitlement_id":null,"terminal_snapshot_id":null,"valuation_price":"11"},"schema_version":"gv_fs0_portfolio_event_v1","security_id":"SEC_1","semantic_sequence":2,"session":"2026-07-14","source_intent_id":"VALUATION_INSTRUCTION:1","source_sequence":1},{"book_id":"BOOK_5ffe57275f0cd6de7bdc1c99aa135ba9a7078afe8993b8f418452dd39b3fe0cd","decision_id":"DECISION_E0A_HOLD_FOR_EVIDENCE_1","effective_timestamp":"2026-07-15T20:00:00.000000Z","event_id":"EVT_4c688a2f92f0c740e6128a88136704d4c1c7cf583a16b4dbbe0e27ffdf093dad","event_type":"SESSION_VALUATION","event_type_rank":80,"generated_event_slot":10,"intra_rank_sequence":0,"payload":{"cash_delta":null,"certification_id":null,"dividend_amount_per_share":null,"entitled_quantity":null,"execution_price":null,"fee":null,"payment_amount":null,"position_delta":null,"quantity":null,"receivable_amount":null,"referenced_entitlement_id":null,"terminal_snapshot_id":null,"valuation_price":"12"},"schema_version":"gv_fs0_portfolio_event_v1","security_id":"SEC_1","semantic_sequence":3,"session":"2026-07-15","source_intent_id":"VALUATION_INSTRUCTION:2","source_sequence":2},{"book_id":"BOOK_5ffe57275f0cd6de7bdc1c99aa135ba9a7078afe8993b8f418452dd39b3fe0cd","decision_id":"DECISION_E0A_HOLD_FOR_EVIDENCE_1","effective_timestamp":"2026-07-16T20:00:00.000000Z","event_id":"EVT_bdaf22123b04372be9bf77bfe5d58fbbd18ab0db26aaf3f6e1d8e28571ddf14b","event_type":"SESSION_VALUATION","event_type_rank":80,"generated_event_slot":10,"intra_rank_sequence":0,"payload":{"cash_delta":null,"certification_id":null,"dividend_amount_per_share":null,"entitled_quantity":null,"execution_price":null,"fee":null,"payment_amount":null,"position_delta":null,"quantity":null,"receivable_amount":null,"referenced_entitlement_id":null,"terminal_snapshot_id":null,"valuation_price":"13"},"schema_version":"gv_fs0_portfolio_event_v1","security_id":"SEC_1","semantic_sequence":4,"session":"2026-07-16","source_intent_id":"VALUATION_INSTRUCTION:3","source_sequence":3},{"book_id":"BOOK_5ffe57275f0cd6de7bdc1c99aa135ba9a7078afe8993b8f418452dd39b3fe0cd","decision_id":"DECISION_E0A_HOLD_FOR_EVIDENCE_1","effective_timestamp":"2026-07-17T20:00:00.000000Z","event_id":"EVT_801b5f83de7198d980415a43bc7e752482c5dc5db0599eab55a78d79a81f6992","event_type":"SESSION_VALUATION","event_type_rank":80,"generated_event_slot":10,"intra_rank_sequence":0,"payload":{"cash_delta":null,"certification_id":null,"dividend_amount_per_share":null,"entitled_quantity":null,"execution_price":null,"fee":null,"payment_amount":null,"position_delta":null,"quantity":null,"receivable_amount":null,"referenced_entitlement_id":null,"terminal_snapshot_id":null,"valuation_price":"14"},"schema_version":"gv_fs0_portfolio_event_v1","security_id":"SEC_1","semantic_sequence":5,"session":"2026-07-17","source_intent_id":"VALUATION_INSTRUCTION:4","source_sequence":4},{"book_id":"BOOK_5ffe57275f0cd6de7bdc1c99aa135ba9a7078afe8993b8f418452dd39b3fe0cd","decision_id":"DECISION_E0A_HOLD_FOR_EVIDENCE_1","effective_timestamp":"2026-07-17T20:00:00.000000Z","event_id":"EVT_3affd04091b5e9f640f64afa36639cd3169b8b4e4e833435fe796c15f4ae2764","event_type":"CERTIFICATION_REFERENCE","event_type_rank":90,"generated_event_slot":10,"intra_rank_sequence":0,"payload":{"cash_delta":null,"certification_id":"CERT_308076a3e72b225de52c0647e16b66569faf299a3cd7a71357a03f5d3b28d476","dividend_amount_per_share":null,"entitled_quantity":null,"execution_price":null,"fee":null,"payment_amount":null,"position_delta":null,"quantity":null,"receivable_amount":null,"referenced_entitlement_id":null,"terminal_snapshot_id":"SNAP_2e